qid, Subject,Year, section, Question,Option A,Option B,Option C,Option D,Correct,Explanation,Image, passage
24,ትግርኛ,2016,መምርሒ 3,"ምንባብ ሓደ
1  ሓደ በዓል ፀጋ ዕድመ ወላዲ ኣብ ደረት ግራት ኮፍ ኢሎም ርሑቕ እናማዕደዉ ከለዉ...ሃንደበት ሓደ መንእሰይ ብጥቕኦም እንትሓልፍ ድምፂ ሰሚዖም...ትሕት ብዝበለ ድምፂ ""መን ኢኻ?"" ይብልዎ። ጓሳ ከብቲ ምዃኑ ገለፀሎም'ሞ “ሃፂፅካ ከይትኾን እምበር ክትምልሳ ዝግበአካ ሕቶ ነይራትኒ።"" ምስበልዎ ፍቓደኛ ምዃኑ ተዛረቦም።

2  “ዓብዪ ሰብ እንተሞተ 'ዶ ይሐሽስ መንእሰይ እንተሞተ?” ይብልዎ። ትቕብል ኣቢሉ ""እቲ ዓብዪ ብዙሕ ስለዝራኣየ ክመውት ኣለዎ ምበልኩ።"" በሎም። ፍሽክ እናበለ። ትቕብል ኣቢሎም “ዓብዪ እንድሕር ሞይቱ ደኣ ነቲ መንእሰይ እቲ ናይ ዓበይቲ ታሪኽ መን ክዛረቦ? በልዎ።

ትቕብል ኣቢሉ “ሓቆም እዮም ታሪኽ ዘዘንትወሉን ዘውርሶን ስለዘየለ መንእሰይ ክመውት ኣለዎ።” በሎም። ""መንእሰይ እንተድኣ ዘየለ እቲ ሽማግለ ንመን ከውርሶ?” በልዎ። መንእሰይ ድማ “እሞ ክልቲኦም ይሙቱ።” በሎም። “ክልቲኦም እንተሞይቶም ድኣ ዓዲ መን ክርከባን ከረክባን?” በልዎ። ወጠርቲ ሕቶታት ምዃነን ኣሚኑ “እሞ መን ድኣ ክመውት ኣለዎ። ይብሉ? በሎም።

3  ""ኣነ ክመውት ኣለዎ ዝብሎ'ማ ብሽም ዓበየን ንኣሰን ዘይኮነስ...ብሽም ቁም ነገር እዩ።” በልዎ። ""ከመይ ማለት?"" በሎም። “ዋእ... ካብ ዓበይቲ ንመናእሰይ ታሪኽ ከየውረሰ ሒዝዎ ዝቕበር፤ ካብ መናእሰይ ድማ ታሪኸ ክፈልጥ ዘይሓትትን ዝተቐበሎ ሕድሪ ኣብ ተግባር ዘየውዕልን ክሞቱ ኣለዎም በሃላይ እየ።” በልዎ። መንእሰይ ብልሖምን ኣንደበቶምን እናንኣደ ክገብሮ ዝግበኦ እናሰላሰለ ናብ መጓሰ ከፍቱ ከደ።

ፍልፍል፡ ውርሲ መድብል ግጥምታት 2002 ዓ.ም

“ኣነ ክመውት ኣለዎ ዝብሎ ብሽም ቁም ነገር...” (ዓንቀፅ 3) ኢሎም ዘብራህርህሉ ሓሳብ ነየናይ ይገልፅ?",ታሪኽ ዘየውርስን ታሪኽ ዘተግብርን,ታሪኽ ዘየውርስን ታሪኽ ዘየተግብርን,ታሪኽ ዝፈልጥን ታሪኽ ዘይፈልጥን,ታሪኽ ክፈልጥ ዝሓትትን ታሪኽ ዘይፈልጥን,B,,
25,ትግርኛ,2016,መምርሒ 3,"ምንባብ ሓደ
1  ሓደ በዓል ፀጋ ዕድመ ወላዲ ኣብ ደረት ግራት ኮፍ ኢሎም ርሑቕ እናማዕደዉ ከለዉ...ሃንደበት ሓደ መንእሰይ ብጥቕኦም እንትሓልፍ ድምፂ ሰሚዖም...ትሕት ብዝበለ ድምፂ ""መን ኢኻ?"" ይብልዎ። ጓሳ ከብቲ ምዃኑ ገለፀሎም'ሞ “ሃፂፅካ ከይትኾን እምበር ክትምልሳ ዝግበአካ ሕቶ ነይራትኒ።"" ምስበልዎ ፍቓደኛ ምዃኑ ተዛረቦም።

2  “ዓብዪ ሰብ እንተሞተ 'ዶ ይሐሽስ መንእሰይ እንተሞተ?” ይብልዎ። ትቕብል ኣቢሉ ""እቲ ዓብዪ ብዙሕ ስለዝራኣየ ክመውት ኣለዎ ምበልኩ።"" በሎም። ፍሽክ እናበለ። ትቕብል ኣቢሎም “ዓብዪ እንድሕር ሞይቱ ደኣ ነቲ መንእሰይ እቲ ናይ ዓበይቲ ታሪኽ መን ክዛረቦ? በልዎ።

ትቕብል ኣቢሉ “ሓቆም እዮም ታሪኽ ዘዘንትወሉን ዘውርሶን ስለዘየለ መንእሰይ ክመውት ኣለዎ።” በሎም። ""መንእሰይ እንተድኣ ዘየለ እቲ ሽማግለ ንመን ከውርሶ?” በልዎ። መንእሰይ ድማ “እሞ ክልቲኦም ይሙቱ።” በሎም። “ክልቲኦም እንተሞይቶም ድኣ ዓዲ መን ክርከባን ከረክባን?” በልዎ። ወጠርቲ ሕቶታት ምዃነን ኣሚኑ “እሞ መን ድኣ ክመውት ኣለዎ። ይብሉ? በሎም።

3  ""ኣነ ክመውት ኣለዎ ዝብሎ'ማ ብሽም ዓበየን ንኣሰን ዘይኮነስ...ብሽም ቁም ነገር እዩ።” በልዎ። ""ከመይ ማለት?"" በሎም። “ዋእ... ካብ ዓበይቲ ንመናእሰይ ታሪኽ ከየውረሰ ሒዝዎ ዝቕበር፤ ካብ መናእሰይ ድማ ታሪኸ ክፈልጥ ዘይሓትትን ዝተቐበሎ ሕድሪ ኣብ ተግባር ዘየውዕልን ክሞቱ ኣለዎም በሃላይ እየ።” በልዎ። መንእሰይ ብልሖምን ኣንደበቶምን እናንኣደ ክገብሮ ዝግበኦ እናሰላሰለ ናብ መጓሰ ከፍቱ ከደ።

ፍልፍል፡ ውርሲ መድብል ግጥምታት 2002 ዓ.ም

በቲ ንባብ መሰረት እቲ መንእሰይ ሒዝዎ ዝኸደ ቁም ነገር እንታይ እዩ?",ታሪኽ ምስራሕን ምምሕላፍን,ታሪኽ ምዕቃብን ምዝንታውን,ታሪኽ ሒዝካ ምቕባር,ታሪኽ ምሕታትን ምትግባርን,D,,
26,ትግርኛ,2016,መምርሒ 4,"መምርሒ 4፦ ካብ ተራ ቁፅሪ 26-40 ንዘለዉ ሕቶታት ሰዋስው ንሕድሕድ ሕቶ ካብ ዝቐረቡ መማረፅታት ነቲ ትኽክል መልሲ ዝሓዘ ፊደል ብምምራፅ ኣብ መልሲ መውሃቢ ወረቐት ኣፀልም/ሚ።

ካብዞም ዝስዕቡ ቃላት ""-ኣም"" ዝብል ምእላድ ብምፅጋዕ ዝረብሕ ኣየናይ እዩ?",ሰንኪ,ሃገር,ፍትሒ,ሰብ,A,,
27,ትግርኛ,2016,መምርሒ 4,"""ዝተፈተኑ"" ኣብ ዝብል ቃል ዘለዉ ምእላዳት ተተንቲኖም እንትፀሓፉ ትኽክለኛ ኣፀሓሕፋ ኣየናይ እዩ?",ዝተ-ፈተኑ-ኡ,ዝ-ተፈተነ-ኡ,ዝ-ተ-ፈተነ-ኡ,ዝተ-ፈተነ-ኡ,C,,
28,ትግርኛ,2016,መምርሒ 4,ካብዞም ዝስዕቡ ቃላት ብክፍሊ ቃሉ ዝተፈለየ ኣየናይ እዩ?,ፅሕፈት,ፀሓፊ,መፅሓፍ,ምፅሓፍ,B,,
29,ትግርኛ,2016,መምርሒ 4,"""ትምህርቲ ንዕብየት ሓንቲ ሃገር ወሳኒ እዩ።"" እቲ ቃል ዝተሰመረሉ እንታይ ዓይነት ሓረግ እዩ?",ግሳዊ ሓረግ,መስተዋድዳዊ ሓረግ,ቅፅላዊ ሓረግ,ስማዊ ሓረግ,D,,
30,ትግርኛ,2016,መምርሒ 4,"""ራሕማ ንጉሆ ፀባ ሰትያ"" ኣብ ዝብል ሙሉእ ሓሳብ መማልኢ ኣየናይ እዩ?",ራሕማ,ንጉሆ,ፀባ,ሰትያ,B,,
31,ትግርኛ,2016,መምርሒ 4,ካብዞም ዝስዕቡ ሰዋስዋዊ ሕጊ ቋንቋ ትግርኛ ተኸቲሉ ዝተፃሕፈ ኣየናይ እዩ?,ቤት ትምህርቲ,ኣብነት ሆቴል,ዓድዋ ከተማ,ፖሊስ ጣብያ,A,,
32,ትግርኛ,2016,መምርሒ 4,ኣበላልዓ ኢልና ብልዒ እንተኢልና፣ ኣሰታትያ ኢልና እንታይ ንብል?,ሰታዪ,መስተ,ዝስተ,መስተዪ,B,,
33,ትግርኛ,2016,መምርሒ 4,ክብሮም ፃዕዳ ርግቢት የራብሕ እዩ። ሰዋስዋዊ ረብሓ እቲ ዝተሰመረሉ ቃል እንታይ እዩ?,ተገላፂ,መስተዋድድ,ተወሳከ ግስ,ገላፂ,D,,
34,ትግርኛ,2016,መምርሒ 4,ኣልማዝ ኩሉጊዜ መፅሓፍ ተንብብ። ናይዚ ሙሉእ ሓሳብ በዓል ቤት ኣየናይ እዩ?,ኣልማዝ,ኩሉጊዜ,መፅሓፍ,ተንብብ,A,,
35,ትግርኛ,2016,መምርሒ 4,ካብዞም ዝስዕቡ ቃላት ስም ውልቀ ዝኾነ ኣየናይ እዩ?,ሰብ,እንስሳ,ረዳኢ,ዕለት,C,,
36,ትግርኛ,2016,መምርሒ 4,ገዝኡ ኣብ ዝብል ቃል ዝርከብ «-ኡ» ሰዋስዋዊ ፍትሑ እንታይ እዩ?,በዝሒ ሓባሪ,ዋንነት ሓባሪ,ገላፂ,ቃል መስራቲ,B,,
37,ትግርኛ,2016,መምርሒ 4,"""__ ሓገዝ ህዝቡ __፡፡"" ካብዞም ዝስዕቡ መማረፅታት ነዞም ክፍቲ ቦታታት ከማልኡ ዝኽእሉ ቃላት ዝሓዘ መማረፂ ኣየናየ እዩ?",ምስ - ተዓዊቱ,ካብ - ምፅዋት,ሳላ - ዘይተዓወተ,ሳላ - ተዓዊቱ,D,,
38,ትግርኛ,2016,መምርሒ 4,"""ቱሪዝም ቁጠባዊ ዓቕሚ ሃገራት የዕቢ"" ሰዋስዋዊ ቅርፂ እዚ ሙሉእ ሓሳብ እንታይ እዩ?",ሕውስዋስ,ነፀላ,ድርብ,ድርብ ሕውስዋስ,B,,
39,ትግርኛ,2016,መምርሒ 4,"""ክመፅእ"" ዝብል ግሲ እንታይ ጊዜ የመላኸት?",መፃኢ,ህልዊ,ክውን,ሕሉፍ,A,,
40,ትግርኛ,2016,መምርሒ 4,"""ትግራይ መበቆል ጀጋኑ እያ"" እዚ ሙሉእ ሓሳብ ብግልጋሎቱ ኣብ እንታይ ይምደብ?",ትእዛዛዊ,ሓተታዊ,ሕቶኣዊ,ኣጋንኖኣዊ,B,,
41,ትግርኛ,2016,መምርሒ 5,"መምርሒ 5፦ ካብ ተራ ቁፅሪ 41-48 ዘለዉ ሕቶታት ኣብ ፅሕፈት ዘተኮሩ እዮም። ንሕድሕድ ሕቶ ካብ ዝቐረቡ መማረፅታት ነቲ ትኽክል መልሲ ዝሓዘ ፊደል ብምምራፅ ኣብ መልሲ መውሃቢ ወረቐት ኣፀልም/ሚ።

ፈላማይ ተግባር ከይዲ ፅሕፈት ኣየናይ እዩ?",ትልሚ ምሕንፃፅ,ሓሳብ ምእካብ,ረቂቕ ምፅሓፍ,ርእሲ ምምራፅ,D,,
42,ትግርኛ,2016,መምርሒ 5,ካብዞም ዝስዕቡ ቃላት ብግቡእ ኣፀሓሕፋ ቋንቋ ትግርኛ ዘይተፃሓፈ ቃል ኣየናይ እዩ?,ሕርየት,ፅፈት,መሬት,ሕውየት,C,,
43,ትግርኛ,2016,መምርሒ 5,"""ህፃናት ንድኽዳኸ ዝቓልዑ ዘለዉ ዝተመጣጠነ ምግቢ ስለዘይረኸቡ እዮም።"" ኣብዚ ሙሉእ ሓሳብ ውፂኢት እንታይ እዩ?",ህፃናት ንድኽዳኸ ምቕላዕ,ዝተመጣጠነ ምግቢ ዘይምርካብ,ዝተመጣጠነ ምግቢ ምርካብ,ህፃናት ከይድኽድኹ ምጥንቓቕ,A,,
44,ትግርኛ,2016,መምርሒ 5,"ዝስዕብ ፅሑፍ ነየናይ ዓይነት መይላ መማዕበሊ ዓንቀፅ ኣብነት ክኸውን ይኸእል?

""ገነት ሓፃር ኮይና ንማዕዶ ዝበርቕ ቅይሓ ሪኢኻ ሕዋስ ፈረንጂ እያ ትመስል። ኣዒንታ ፈጠጠጥ እንትብላ ንድሕሪት እውን ትሪኢ ዘላ የምስላ። ገፃ ክብብ ኢሉ ፀቢብ ብምዃኑ ኣዒንታ ቦታ ፀቢቡወን ልዕል ክብላ ዝተገደዳ መሲለን ፈሪየን ይረኣያ።“",ሓባሪ ,ገላፂ, ኣመዛዛኒ,ዘንታዊ,B,,
45,ትግርኛ,2016,መምርሒ 5,ካብዞም ዝስዕቡ ሙሉእ ሓሳባት ወድዓዊ ሓቂ ዝኾነ ኣየናይ እዩ?,ኣነ ቀይሕ ሕብሪ ክዳን ኣይፈቱን።,ምግቢ መሰረታዊ ድሌት ደቂ ሰባት እዩ።,እንድሕር ጠንኪርካ ዘይትምሃር፣ ናብ ማሕረስካ ተመለስ።,ጨና ኣዳም ፈውሲ ቁርፀት ከብዲ እዩ።,B,,
46,ትግርኛ,2016,መምርሒ 5,ሓደ ዝበዓል ቤቶምን ዓርሶም ዝኻኣሉን ሙሉእ ሓሳባት ንምፍላይ እንጥቀመሉ ስርዓተ ነጥቢ ኣየናይ እዩ?,ነፀላ ሰረዝ,ትእምርተ ኣንክሮ,ድርብ ሰረዝ,ክልተ ነጥቢ,C,,
47,ትግርኛ,2016,መምርሒ 5,"እዚ ዝስዕብ ፅሑፍ ነየናይ ዓይነት መይላ መማዕበሊ ዓንቀፅ ኣብነት ክኸውን ይኸእል?

""ሜጀር ጀነራል ሓየሎም ኣብ ወርሒ ነሓሰ 1948 ዓ.ም ካብ ኣብኡ ደጃዝማች ኣርኣያ ገ/እግዚኣብሄርን ካብ ኣዲኡ ወ/ሮ ሮማን ኣየነውን ንስድርኡ ሻምናይ ውላድ ኮይኑ ተወሊዱ።""",ዘንታዊ,ገላፂ, ኣመዛዛኒ,ሓባሪ,A,,
48,ትግርኛ,2016,መምርሒ 5,ብመዝገበ ቃላዊ ፊደላት ቋንቋ ትግርኛ ቅደም ሰዓብ ሓልዮም ዝተፃሓፉ ቃላት ዝሓዘ ኣየናይ እዩ?,ሓጎስ፣ ለተብርሃን፣ ስዒድ፣ ሸዊት፣ ቀለም,ለተብርሃን፣ ስዒድ፣ ሓጎስ፣ ሸዊት፣ ቀለም,ለተብርሃን፣ ሓጎስ፣ ሽዊት፣ ስዒድ፣ ቀለም,ለተብርሃን፣ ሓጎስ፣ ስዒድ፣ ሸዊት፣ ቀለም,D,,
49,ትግርኛ,2016,መምርሒ 6,"መምርሒ 6፦ ካብ ተራ ቁፅሪ 49-55 ዘለዉ ሕቶታት ኣብ ስነ ፅሑፍ ዘተኮሩ እዮም። ንሕድሕድ ሕቶ ካብ ዝቐረቡ መማረፅታት ነቲ ትኽክል መልሲ ዝሓዘ ፊደል ብምምራፅ ኣብ መልሲ መውሃቢ ወረቐት ኣፀልም/ሚ።

“በትረይ ሃቡኒ፣ _____” ነዚ ጅሙር ምስላ ከማልእ ዝኽእል ሓረግ ኣየናይ እዩ?",ዘሳድዶ ኣለኒ,ዘሕምቆ ኣለኒ,ዝኸዶ ኣለኒ,ደው በዚሑኒ,B,,
50,ትግርኛ,2016,መምርሒ 6,“ኣብ _____፣ ኣይትዛረብ ክፉእ” ነዚ ጅሙር ምስላ ከማልእ ዝኸእል ቃል ኣየናይ እዩ?,ውድእ,ርኹብ,ጥፉእ,ምዉት,C,,
51,ትግርኛ,2016,መምርሒ 6,ካብ ባእታታት ልቢ ወለድ ታሪክ ተላቢሱ ዝቐርብ ኣየናይ እዩ?,ገፀ ባህሪ,ጎንፂ,ውዲት,መዓበይ,A,,
52,ትግርኛ,2016,መምርሒ 6,ካብዞም ዝስዕቡ ባህሪ ስነ ግጥሚ ዘይኮነ ኣየናይ እዩ?,ሙሩፃት ቃላት ይጥቀም,ብተለላይ ዋደድ,ቤት ይወቅዕ,ብዓንቀፃት ይምቀል,D,,
53,ትግርኛ,2016,መምርሒ 6,ብሓደ ልቢ ወለድ ኣቢልካ ክመሓላለፍ ዝተደለየ መልእኸቲ እንታይ ይባሃል?,ጎንፂ,ጭብጢ,መዓበይ,ውዲት,B,,
54,ትግርኛ,2016,መምርሒ 6,"""ያሬድ ብባህሪኡ ነብሪ እዩ።"" ኣብ ዝብል ሙሉእ ሓሳብ ዘሎ ተምሳሌታዊ ኣዘራርባ ኣየናይ እዩ?",ኣነፃፃሪ,ሰባይ,ለዋጢ,ኣይወ,C,,
55,ትግርኛ,2016,መምርሒ 6,ባህላዊ ደርፍታት ኣብ ኣየናይ ዓይነት ስነ ፅሑፍ ይካተቱ?,ቃላዊ ግጥሚ,ልቢ ወለድ,ኢ-ልቢ ወለድ,ተዋስኦ,A,,
56,ትግርኛ,2016,መምርሒ 7,"መምርሒ 7፦ ካብ ተራ ቁፅሪ 56-60 ዘለዉ ሕቶታት ኣብቲ ቀፂሉ ቀሪቡ ዘሎ ግጥሚ ብምድራኽ ዝምለሱ እዮም። ንሕድሕድ ሕቶ ካብ ዝቐረቡ መማረፅታት ነቲ ትኽክል መልሲ ዝሓዘ ፊደል ብምምራፅ ኣብ መልሲ መውሃቢ ወረቐት ኣፀልም/ሚ።

ምንባብ ክልተ

እቲ ቀደም ቀደም ብዘመን እኒእኒ
ሰብ ብለዋሁ ሕምባሻያ ነይሩ እምኒ
ተባሂሉ ነበርያ ነበረ እንትውጋዕ
ምእማኑ የፀግመለይ ነይሩ ታሪኽ እንትሰምዕ።
ግን ድማ ከብዲ ዝዕንግል ሕምባሻ ምንባሩ
ትነበርያ ነበረ ሓቂ ኮይኑ ረኺበዮ ምሽጥሩ
ሎሚ እውን ብሕምባሽኡ እኒሆ ማዓዝ ተቐይሩ
ይጥውረኒ ኣሎ ካልኣይ ተፈጢሩ
ኣብ ክንዲ መንገዲ ካትራመ ተዋቒሩ።

ፍልፍል፦ «ውርሲ መድብል ግጥምታት» 2002 ዓ.ም ንፈተና ብዝጥዕም ተመዓራርዩ ዝተወሰደ።

እዚ ግጥሚ ንመን ይገልፅ?",ንሕምባሻ,ንገንዘብ,ንካትራመ,ንኮብልስቶን,D,,
57,ትግርኛ,2016,መምርሒ 7,"ምንባብ ክልተ

እቲ ቀደም ቀደም ብዘመን እኒእኒ
ሰብ ብለዋሁ ሕምባሻያ ነይሩ እምኒ
ተባሂሉ ነበርያ ነበረ እንትውጋዕ
ምእማኑ የፀግመለይ ነይሩ ታሪኽ እንትሰምዕ።
ግን ድማ ከብዲ ዝዕንግል ሕምባሻ ምንባሩ
ትነበርያ ነበረ ሓቂ ኮይኑ ረኺበዮ ምሽጥሩ
ሎሚ እውን ብሕምባሽኡ እኒሆ ማዓዝ ተቐይሩ
ይጥውረኒ ኣሎ ካልኣይ ተፈጢሩ
ኣብ ክንዲ መንገዲ ካትራመ ተዋቒሩ።

ፍልፍል፦ «ውርሲ መድብል ግጥምታት» 2002 ዓ.ም ንፈተና ብዝጥዕም ተመዓራርዩ ዝተወሰደ።

እዚ ግጥሚ በዓል ክንደይ ብርኪ እዩ?",ሓደ,ክልተ,ሰለስተ,ኣርባዕተ,B,,
58,ትግርኛ,2016,መምርሒ 7,"ምንባብ ክልተ

እቲ ቀደም ቀደም ብዘመን እኒእኒ
ሰብ ብለዋሁ ሕምባሻያ ነይሩ እምኒ
ተባሂሉ ነበርያ ነበረ እንትውጋዕ
ምእማኑ የፀግመለይ ነይሩ ታሪኽ እንትሰምዕ።
ግን ድማ ከብዲ ዝዕንግል ሕምባሻ ምንባሩ
ትነበርያ ነበረ ሓቂ ኮይኑ ረኺበዮ ምሽጥሩ
ሎሚ እውን ብሕምባሽኡ እኒሆ ማዓዝ ተቐይሩ
ይጥውረኒ ኣሎ ካልኣይ ተፈጢሩ
ኣብ ክንዲ መንገዲ ካትራመ ተዋቒሩ።

ፍልፍል፦ «ውርሲ መድብል ግጥምታት» 2002 ዓ.ም ንፈተና ብዝጥዕም ተመዓራርዩ ዝተወሰደ።
እዚ ግጥሚ በዓል ክንደይ ተለላ እዩ?",ክልተ,ሰለስተ,ሓሙሽተ,ትሽዓተ,D,,
59,ትግርኛ,2016,መምርሒ 7,"ምንባብ ክልተ

እቲ ቀደም ቀደም ብዘመን እኒእኒ
ሰብ ብለዋሁ ሕምባሻያ ነይሩ እምኒ
ተባሂሉ ነበርያ ነበረ እንትውጋዕ
ምእማኑ የፀግመለይ ነይሩ ታሪኽ እንትሰምዕ።
ግን ድማ ከብዲ ዝዕንግል ሕምባሻ ምንባሩ
ትነበርያ ነበረ ሓቂ ኮይኑ ረኺበዮ ምሽጥሩ
ሎሚ እውን ብሕምባሽኡ እኒሆ ማዓዝ ተቐይሩ
ይጥውረኒ ኣሎ ካልኣይ ተፈጢሩ
ኣብ ክንዲ መንገዲ ካትራመ ተዋቒሩ።

ፍልፍል፦ «ውርሲ መድብል ግጥምታት» 2002 ዓ.ም ንፈተና ብዝጥዕም ተመዓራርዩ ዝተወሰደ።

እዚ ግጥሚ በዓል ክንደይ ቤት እዩ?",ሓደ,ክልተ,ሰለስተ,ኣርባዕተ,C,,
60,ትግርኛ,2016,መምርሒ 7,"ምንባብ ክልተ

እቲ ቀደም ቀደም ብዘመን እኒእኒ
ሰብ ብለዋሁ ሕምባሻያ ነይሩ እምኒ
ተባሂሉ ነበርያ ነበረ እንትውጋዕ
ምእማኑ የፀግመለይ ነይሩ ታሪኽ እንትሰምዕ።
ግን ድማ ከብዲ ዝዕንግል ሕምባሻ ምንባሩ
ትነበርያ ነበረ ሓቂ ኮይኑ ረኺበዮ ምሽጥሩ
ሎሚ እውን ብሕምባሽኡ እኒሆ ማዓዝ ተቐይሩ
ይጥውረኒ ኣሎ ካልኣይ ተፈጢሩ
ኣብ ክንዲ መንገዲ ካትራመ ተዋቒሩ።

ፍልፍል፦ «ውርሲ መድብል ግጥምታት» 2002 ዓ.ም ንፈተና ብዝጥዕም ተመዓራርዩ ዝተወሰደ።

ካብዞም ዝስዕቡ ተለላታት ብሰባይ ምስላዊ ኣዘራርባ ዝተገለፀ ኣየናይ እዩ?",እቲ ቀደም ቀደም ብዘመን እኒእኒ,ሕምባሻ ነይሩ እምኒ,ትነብር ያነበረ ሓቂ ኮይኑ,ይጥውረኒ ኣሎ ካልኣይ ተፈጢሩ,D,,
1,English,2016,Grammar,"Part One: Language Focus/Grammar
Direction: For Question (1-26), choose the alternative that can be the best answer for the given items.

We could see our reflection in the _____ surface of the marble.",shiny,shine,gloom,gloomy,A,,
2,English,2016,Grammar,"If he comes, ____",he would have a cup of coffee.,he will have a cup of coffee.,he should have a cup of coffee.,he had a cup of coffee.,B,,
3,English,2016,Grammar,We know ___ way we should turn at the stoplight.,where,when,which,how,C,,
4,English,2016,Grammar,The government has funded the families __ children died at war front.,which,whom,who,whose,D,,
5,English,2016,Grammar,She is either a teacher _____ a doctor.,nor,or,and,but also,B,,
6,English,2016,Grammar,Have you ever visited Aksum obelisks?,"Yes, I had.","No, I hadn't.","Yes, I have.","No, I have.",C,,
7,English,2016,Grammar,"I telephoned her many times, ___ I couldn't meet her.",so,and,or,yet,D,,
8,English,2016,Grammar,Tekeze is ____ river in Tigray.,the longest,longer,the longer,long,A,,
9,English,2016,Grammar,Which one of the following is passive sentence?,He was an engineer.,He was so happy.,He was sent back.,He did it well.,C,,
10,English,2016,Grammar,It was nice to meet you ____.,today,everyday,now,yesterday,D,,
11,English,2016,Grammar,Hanna is ____ than her little sister.,smarter,smart,smartest,the smartest,A,,
12,English,2016,Grammar,Careful __ made me be successful.,to plan,planning,to have planned,planned,B,,
13,English,2016,Grammar,Which one of the following is correctly written?,You have yet missed the bus.,Have you yet missed the bus?,You haven't already missed the bus.,Have you already missed the bus?,D,,
14,English,2016,Grammar,Look at the cloud. It ____ rain soon.,are going to,going to,is going to,be going to,C,,
15,English,2016,Grammar,"Helen weighs 37 kilos and Fitsum weighs 51 kilos. So, Fitsum is __ than Helen.",fat,fatter,the fattest,fattest,B,,
16,English,2016,Grammar,The teacher ____ you were talking to is my uncle.,whom,whose,where,when,A,,
17,English,2016,Grammar,Akeza __ her bed and went out.,made,make,makes,making,A,,
18,English,2016,Grammar,"Your lung is not working properly, you ____ stop smoking cigarette.",should not,had better,do not have to,must not,B,,
19,English,2016,Grammar,"If she ____ slept early, she would have missed her dinner.",have,has,had,to have,C,,
20,English,2016,Grammar,Which one of the following is a passive sentence?,They cannot reach the ceilings.,He breaks the window irreversibly.,The student has cleaned the chalk board.,The rule of law is violated.,D,,
21,English,2016,Grammar,"Before the teacher left the classroom, she _____ us a lot of activities to do.",give,had given,has given,gave,B,,
22,English,2016,Grammar,"Change into reported speech; he said, ""I want to go.""",He said that he had wanted to go.,He said that he wants to go.,He said that he wanted to go.,He said that I wanted to go.,C,,
23,English,2016,Grammar,They will have _____ all their supply two weeks from now.,finish,finishes,finishing,finished,D,,
24,English,2016,Grammar,"While my mother was baking bread, I ____ onions.",was chopping,are chopping,am chopping,were chopping,A,,
25,English,2016,Grammar,Which one of the following contains a non-defining clause?,The woman who is coming towards us is a mother of mine.,The teacher who usually wears a green T-shirt is my father.,"Tigray, which is the neighbor of Sudan, is a home of brave people.",The cow which my father bought yesterday has died.,C,,
26,English,2016,Grammar,"Abrehet, Hailemariam and Mammit are siblings. Abrehet is 15 years old; Hailemariam is 12 years old; and Mammit is 6 years old. So, Mammit is ____ of all.",the older,the oldest,the younger,the youngest,D,,
27,English,2016,Grammar,"Section One: Vocabulary
Direction: For questions (27-32), choose the best word which substitutes the underlined word in the sentence from the given alternatives to get a similar meaning.


The outlook of the international community on Tigray genocide remains the same. It is still __**stationary**__.",unchangeable,mobile,changeable,flexible,A,,
28,English,2016,Grammar,All the __**spectators**__ in the stadium stood up surprisingly when the player shot the ball towards the goal.,referees,watchers,commentators,players,B,,
29,English,2016,Grammar,I had such a __**tough**__ time at elementary school that I missed some final exams.,comfortable,fertile,favorable,difficult,D,,
30,English,2016,Grammar,The sack was so __**huge**__ that he couldn't carry it easily.,very small,very simple,very large,very tiny,C,,
31,English,2016,Grammar,I __**took**__ my breakfast early in the morning but I was not fully satisfied.,held,ate,brought,owned,B,,
32,English,2016,Grammar,"Parents are next to God, so we should __**honor**__ them.",privilege,discourage,dishonest,undermine,A,,
